{
  "schemaVersion": "0.4.0",
  "packageId": "org.enterprise-blueprints.common",
  "version": "0.8.0",
  "title": "Common Capabilities — Shared Across Missions",
  "description": "Capabilities nearly every public organization relies on, whatever its mission: identity and access, data protection and privacy, records, security logging, and case management, with their reference requirements, example patterns for them, such as a shared case platform, agency sign-on, security monitoring, and checks of SAM.gov, and a short discovery question set. Mission packages build on this one.",
  "publisher": {
    "name": "Enterprise Blueprints (independent reference project)",
    "url": "https://enterprise-blueprints.github.io"
  },
  "license": "MIT",
  "publishedAt": "2026-10-30",
  "domain": "public-sector",
  "jurisdictions": [
    "United States — federal agencies"
  ],
  "tags": [
    "shared-capabilities",
    "identity",
    "privacy",
    "records-management",
    "case-management",
    "security",
    "reference-architecture"
  ],
  "sources": [
    {
      "id": "src:nist-sp-800-53",
      "title": "NIST SP 800-53 Rev. 5 — Security and Privacy Controls for Information Systems and Organizations",
      "url": "https://csrc.nist.gov/pubs/sp/800/53/r5/upd1/final",
      "kind": "official-reference",
      "lastReviewedAt": "2026-10-27",
      "note": "Control catalog, including the access control, identification and authentication, audit and accountability, and system and communications protection families."
    },
    {
      "id": "src:nist-sp-800-63-4",
      "title": "NIST SP 800-63-4 — Digital Identity Guidelines",
      "url": "https://csrc.nist.gov/pubs/sp/800/63/4/final",
      "kind": "official-reference",
      "publicationDate": "2025-07-31",
      "lastReviewedAt": "2026-10-27",
      "note": "Requirements for identity proofing, authenticators, and authentication for people who use government systems."
    },
    {
      "id": "src:privacy-act",
      "title": "5 U.S.C. § 552a — Records maintained on individuals (Privacy Act of 1974)",
      "url": "https://www.govinfo.gov/link/uscode/5/552a?link-type=html",
      "kind": "official-reference",
      "lastReviewedAt": "2026-10-27",
      "note": "Limits how agencies disclose records about individuals, with listed exceptions, and requires an accounting of many disclosures."
    },
    {
      "id": "src:nist-privacy-framework",
      "title": "NIST Privacy Framework",
      "url": "https://www.nist.gov/privacy-framework",
      "kind": "official-reference",
      "lastReviewedAt": "2026-10-27",
      "note": "A voluntary framework for identifying and managing privacy risk, including knowing what personal data is processed and where."
    },
    {
      "id": "src:records-44-usc-3101",
      "title": "44 U.S.C. § 3101 — Records management by agency heads; general duties",
      "url": "https://www.govinfo.gov/link/uscode/44/3101?link-type=html",
      "kind": "official-reference",
      "lastReviewedAt": "2026-10-27",
      "note": "Agencies must make and keep records that document their organization, functions, policies, decisions, procedures, and essential transactions."
    },
    {
      "id": "src:nara-grs",
      "title": "National Archives — General Records Schedules",
      "url": "https://www.archives.gov/records-mgmt/grs",
      "kind": "official-reference",
      "lastReviewedAt": "2026-10-27",
      "note": "Approved disposition authorities for records common to many federal agencies."
    },
    {
      "id": "src:nist-ai-rmf",
      "title": "NIST — Artificial Intelligence Risk Management Framework (AI RMF 1.0)",
      "url": "https://www.nist.gov/itl/ai-risk-management-framework",
      "kind": "official-reference",
      "publicationDate": "2023-01-26",
      "lastReviewedAt": "2026-10-29",
      "note": "A framework for voluntary use in managing the risks of AI systems, built around four functions, govern, map, measure, and manage, and the characteristics of trustworthy AI, such as being valid, accountable, and fair."
    },
    {
      "id": "src:sam-gov",
      "title": "SAM.gov — System for Award Management",
      "url": "https://sam.gov/",
      "kind": "official-reference",
      "lastReviewedAt": "2026-10-29",
      "note": "Where businesses and other entities register to receive federal awards, and where agencies check registrations, exclusions, and responsibility and qualification records before awarding contracts and grants."
    }
  ],
  "elements": [
    {
      "id": "eb:capability:identity-access-management",
      "type": "capability",
      "title": "Identity & Access Management",
      "description": "Ability to know who is using the office’s systems and to grant, review, and remove their access to information according to their role and need.",
      "status": "reference",
      "sourceIds": [
        "src:nist-sp-800-53",
        "src:nist-sp-800-63-4"
      ],
      "applicabilityNotes": "Shared across missions. Many offices rely on an agency-wide identity service; the office may still own who gets access to its own systems and records."
    },
    {
      "id": "eb:capability:data-protection-privacy",
      "type": "capability",
      "title": "Data Protection & Privacy",
      "description": "Ability to protect sensitive and personal information wherever it’s kept: knowing where it is, limiting who sees it, sharing it only as allowed, and keeping it safe in storage and in transit.",
      "status": "reference",
      "sourceIds": [
        "src:nist-sp-800-53",
        "src:privacy-act",
        "src:nist-privacy-framework"
      ],
      "applicabilityNotes": "Shared across missions. What counts as sensitive, and which disclosures are allowed, depends on the laws and notices that apply to each office."
    },
    {
      "id": "eb:capability:records-management",
      "type": "capability",
      "title": "Records Management",
      "description": "Ability to make and keep records of the office’s work and decisions, and to keep or dispose of each kind of record on an approved schedule.",
      "status": "reference",
      "sourceIds": [
        "src:records-44-usc-3101",
        "src:nara-grs"
      ],
      "applicabilityNotes": "Shared across missions. Schedules for mission-specific records are approved for each agency; the General Records Schedules cover records common to many."
    },
    {
      "id": "eb:capability:security-logging-monitoring",
      "type": "capability",
      "title": "Security Logging & Monitoring",
      "description": "Ability to record what happens in the office’s systems, such as sign-ins, access to sensitive information, and changes, and to review those records and act on what they show.",
      "status": "reference",
      "sourceIds": [
        "src:nist-sp-800-53"
      ],
      "applicabilityNotes": "Shared across missions. Logging is often run agency-wide; the office decides what in its own systems needs watching."
    },
    {
      "id": "eb:capability:case-management",
      "type": "capability",
      "title": "Case Management",
      "description": "Ability to track each matter the office handles, such as a request, a complaint, or a case, from the time it arrives until it’s closed: who has it, where it stands, what’s due when, and what belongs to it.",
      "status": "reference",
      "applicabilityNotes": "Shared across missions. Each mission adds its own steps, such as triage or review, on top of the same way of tracking work."
    },
    {
      "id": "eb:requirement:access-by-role",
      "type": "requirement",
      "title": "Grant access by role and need",
      "description": "Give each person access to the information and systems their role needs, and no more, and change or remove it when their role changes or they leave.",
      "status": "reference",
      "sourceIds": [
        "src:nist-sp-800-53"
      ]
    },
    {
      "id": "eb:requirement:strong-sign-in",
      "type": "requirement",
      "title": "Require strong sign-in",
      "description": "Confirm who people are when they sign in, with more than a password for staff and for anything sensitive.",
      "status": "reference",
      "sourceIds": [
        "src:nist-sp-800-63-4",
        "src:nist-sp-800-53"
      ]
    },
    {
      "id": "eb:requirement:review-access",
      "type": "requirement",
      "title": "Review access regularly",
      "description": "Check who has access to what on a regular schedule, and remove access that’s no longer needed.",
      "status": "reference",
      "sourceIds": [
        "src:nist-sp-800-53"
      ]
    },
    {
      "id": "eb:requirement:encrypt-sensitive-information",
      "type": "requirement",
      "title": "Encrypt sensitive information",
      "description": "Protect sensitive information with encryption while it’s stored and while it moves between systems.",
      "status": "reference",
      "sourceIds": [
        "src:nist-sp-800-53"
      ]
    },
    {
      "id": "eb:requirement:know-where-personal-information-is",
      "type": "requirement",
      "title": "Know where personal information is kept",
      "description": "Keep track of which systems hold personal information, what kinds, and why it was collected.",
      "status": "reference",
      "sourceIds": [
        "src:nist-privacy-framework",
        "src:privacy-act"
      ]
    },
    {
      "id": "eb:requirement:share-personal-information-as-allowed",
      "type": "requirement",
      "title": "Share personal information only as allowed",
      "description": "Disclose records about people only with their consent or under an exception the law allows, and keep an account of disclosures where the law requires one.",
      "status": "reference",
      "sourceIds": [
        "src:privacy-act"
      ]
    },
    {
      "id": "eb:requirement:document-decisions",
      "type": "requirement",
      "title": "Keep records of decisions and actions",